<?xml version="1.0" encoding="UTF-8"?>

<message xmlns:xsi="http://www.w3.org/2001/XMLSchema-instance" xsi:noNamespaceSchemaLocation="map.xsd">
	<data>
		<entry>
			<key>id123</key>
			<value>this is a value</value>
		</entry>
		<entry>
			<key>id312</key>
			<value>this is another value</value>
		</entry>
	</data>
</message>